{
  "$schema": "../../../../templates/playbook-ritual-schema.json",
  "meta": {
    "id": "identificar-expansion-upsell-ritual",
    "segment": "empresas-b2b",
    "sop": "sop-success",
    "version": "V4.5 (HIGH-DENSITY)",
    "standard": "Moat Certified",
    "lastUpdated": "2026-02-16"
  },
  "playbook": {
    "title": "Identificar Expansión & Upsell",
    "subtitle": "Operational Ritual",
    "docType": "Playbook Operativo",
    "sopPhase": "Success",
    "breadcrumb": [
      "MetodologIA",
      "Proceso Comercial",
      "SOP Success",
      "Identificar Expansión & Upsell"
    ],
    "tldr": {
      "hook": "Define la pregunta crítica que este ritual resuelve.",
      "summary": "Resumen ejecutivo de 3 líneas sobre el propósito y resultado esperado.",
      "time": "~30 min",
      "mainOutput": "Contract Addendum"
    },
    "objective": "Detectar oportunidades orgánicas de crecimiento dentro de la cuenta mediante el análisis de necesidades latentes."
  },
  "glossary": [
    {
      "term": "Expansion",
      "definition": "Venta de más asientos o volumen del mismo producto ya contratado."
    },
    {
      "term": "Upsell",
      "definition": "Migración del cliente a un plan o tier superior con funcionalidades premium."
    },
    {
      "term": "Cross-sell",
      "definition": "Venta de productos complementarios de la ontología MetodologIA."
    },
    {
      "term": "Usage Ceiling",
      "definition": "El punto donde el límite del contrato actual frena el crecimiento del cliente."
    }
  ],
  "steps": [
    {
      "title": "Análisis de Consumo",
      "desc": "¿Está cerca del 80% del límite?",
      "output": "Usage Threshold Report"
    },
    {
      "title": "Mapeo de Nuevos Dptos",
      "desc": "¿Quién más en la org tiene este dolor?",
      "output": "Internal Lead Map"
    },
    {
      "title": "Review de 'Wishlist'",
      "desc": "Features que el cliente pidió en soporte.",
      "output": "Feature Gap Analysis"
    },
    {
      "title": "Cálculo de Potencial LTV",
      "desc": "Cuánto más puede valer esta cuenta.",
      "output": "Upside Projection"
    },
    {
      "title": "Briefing de Valor Agregado",
      "desc": "Qué resolvería el nuevo módulo.",
      "output": "Expansion Brief"
    },
    {
      "title": "Diseño de la 'Oferta Moat'",
      "desc": "Paquete exclusivo para clientes VIP.",
      "output": "Loyalty Deal"
    },
    {
      "title": "Handoff CSM a Account Exec",
      "desc": "Si el deal es complejo, involucrar ventas.",
      "output": "Internal Handover"
    },
    {
      "title": "Soft Pitch en QBR",
      "desc": "Presentar la idea como 'evolución sugerida'.",
      "output": "Initial Interest Check"
    },
    {
      "title": "Prueba de Valor (Trial)",
      "desc": "Habilitar 15 días del módulo nuevo.",
      "output": "POV Agreement"
    },
    {
      "title": "Cierre Administrativo",
      "desc": "Addendum al contrato original.",
      "output": "Contract Addendum"
    }
  ],
  "vitamin": "Vender a un cliente actual es 7 veces más barato que conseguir uno nuevo. Tu mina de oro está en los que ya te dijeron que sí.",
  "standard": "Atomic Step 10/10 | Logic: Growth Logistics"
}