{
  "$schema": "../../templates/playbook-ritual-schema.json",
  "meta": {
    "id": "seleccionar-lead-magnet-ritual",
    "segment": "personas-b2c",
    "sop": "sop-scouting-b2c",
    "version": "v3.0.0",
    "standard": "Sovereign Gold Master",
    "lastUpdated": "2026-02-19"
  },
  "playbook": {
    "title": "Selección de Lead Magnet",
    "subtitle": "The Aha! Moment Generator",
    "docType": "Playbook Operativo",
    "sopPhase": "Scouting",
    "breadcrumb": [
      "MetodologIA",
      "Proceso Comercial",
      "SOP Scouting B2C",
      "Selección Lead Magnet"
    ],
    "tldr": {
      "hook": "El primer contacto no debe vender, debe ILUMINAR.",
      "summary": "Este ritual guía la creación de un activo de captación de alto impacto (Mindmap, Quiz, Flashcards) diseñado para generar un hito cognitivo en el prospecto.",
      "time": "~25 min",
      "mainOutput": "Lead Magnet Sync"
    },
    "objective": "Identificar el artefacto que generará la mayor fricción cognitiva positiva (Aha! Moment) en el prospecto para iniciar el flujo de nutrición."
  },
  "glossary": [
    {
      "term": "Aha! Moment",
      "definition": "Hito cognitivo donde el prospecto comprende el valor de nuestra solución y el costo de su problema actual."
    },
    {
      "term": "Shock Artifact",
      "definition": "Contenido diseñado para romper la inercia mental del prospecto mostrando una complejidad ignorada (ej. Mindmap)."
    },
    {
      "term": "Industrial Secret Hook",
      "definition": "Apertura que presenta el contenido como un descubrimiento técnico confidencial en lugar de publicidad."
    },
    {
      "term": "Viral Loop",
      "definition": "Mecanismo psicológico y técnico que incentiva al usuario a compartir el valor recibido con su red."
    }
  ],
  "steps": [
    {
      "title": "Persona Pain Audit",
      "desc": "Escaneamos el arquetipo para encontrar la pregunta técnica que les quita el sueño.",
      "output": "PAIN: Frase semilla del dolor identificada."
    },
    {
      "title": "IA Query: Síntomas",
      "desc": "Usamos IA para profundizar en los síntomas operativos del dolor detectado.",
      "output": "SÍNTOMAS: Mapa de 3 puntos de fricción no obvios."
    },
    {
      "title": "Selección de Formato",
      "desc": "Elegimos entre Mindmap (Shock), Quiz (Validación) o Flashcards (Acción).",
      "output": "FORMATO: Asset de tipo [X] seleccionado."
    },
    {
      "title": "Prompt: Hook Soberano",
      "desc": "IA redacta el título que suena a secreto industrial, no a marketing.",
      "output": "PROMPT: Diseña el Gancho para un Lead Magnet de [Tema]. El título debe sonar a descubrimiento técnico interno."
    },
    {
      "title": "Drafting en Studio",
      "desc": "Generamos el borrador base del contenido usando el motor de NotebookLM.",
      "output": "DRAFT: Versión V1 del contenido generada."
    },
    {
      "title": "Auditoría de Voz",
      "desc": "Limpiamos el contenido de adjetivos vacíos y reforzamos la lógica técnica.",
      "output": "AUDIT: Contenido Neo-Swiss validado."
    },
    {
      "title": "Inyección de 'Aha!'",
      "desc": "Añadimos un benchmark contraintuitivo para asegurar el hito cognitivo.",
      "output": "AHA: Trigger de descubrimiento activado."
    },
    {
      "title": "CRM Tracking Setup",
      "desc": "Configuramos el link y las etiquetas de seguimiento para medir conversión.",
      "output": "TRACKING: Etiqueta de segmento activa en el CRM."
    },
    {
      "title": "Prompt: Variante A/B",
      "desc": "Creamos una versión optimizada para un perfil más agresivo (EB-Focused).",
      "output": "PROMPT: Toma el contenido [A] y adáptala para un Economic Buyer. Menos texto, más tablas, foco en COI."
    },
    {
      "title": "Activación Viral Loop",
      "desc": "Integramos el CTA de recomendación para expandir el alcance del asset.",
      "output": "LOOP: Mecanismo de recomendación activo."
    }
  ],
  "vitamin": "Si tu lead magnet suena a publicidad, has fallado. Si suena a una revelación, has ganado un cliente potencial.",
  "standard": "MetodologIA Sovereign Gold | v3.0"
}
