{
  "$schema": "../../../../templates/playbook-ritual-schema.json",
  "meta": {
    "id": "enriquecer-cuenta-con-ia-ritual",
    "segment": "empresas-b2b",
    "sop": "sop-scouting",
    "version": "v2.1.0",
    "standard": "Moat Certified",
    "lastUpdated": "2026-02-16"
  },
  "playbook": {
    "title": "Enriquecer Cuenta con IA B2B",
    "subtitle": "The AI Intelligence Ritual",
    "docType": "Playbook Operativo",
    "sopPhase": "Scouting",
    "breadcrumb": [
      "MetodologIA",
      "Proceso Comercial",
      "SOP Scouting",
      "Enriquecer Cuenta con IA B2B"
    ],
    "tldr": {
      "hook": "Define la pregunta crítica que este ritual resuelve.",
      "summary": "Resumen ejecutivo de 3 líneas sobre el propósito y resultado esperado.",
      "time": "~30 min",
      "mainOutput": "Dossier de inteligencia comercial"
    },
    "objective": "Utiliza inteligencia artificial avanzada para profundizar en el perfil psicológico y operativo del cliente antes del primer contacto."
  },
  "glossary": [
    {
      "term": "Dossier",
      "definition": "Legajo completo que compila toda la información de inteligencia recolectada sobre la cuenta y sus actores clave."
    },
    {
      "term": "LLM (Large Language Model)",
      "definition": "Modelo de lenguaje extenso (como Gemini) utilizado para procesar y sintetizar grandes volúmenes de datos."
    },
    {
      "term": "10-K",
      "definition": "Informe anual exhaustivo sobre el desempeño financiero de una empresa pública."
    },
    {
      "term": "Stack Tecnológico",
      "definition": "Conjunto de herramientas y servicios de software que componen la infraestructura digital de la empresa."
    }
  ],
  "steps": [
    {
      "title": "Ingesta de Datos",
      "desc": "Alimentar al LLM con la URL corporativa y perfiles públicos para extraer la misión real y la cultura declarada.",
      "output": "Perfil cultural de la cuenta"
    },
    {
      "title": "Análisis Financiero",
      "desc": "Analizar reportes 10-K o notas de prensa para detectar prioridades de inversión declaradas a los accionistas.",
      "output": "Resumen de prioridades financieras"
    },
    {
      "title": "Monitoreo de Noticias",
      "desc": "Escanear medios digitales para detectar señales de cambio recientes como fusiones o crisis.",
      "output": "Alertas de contexto actual"
    },
    {
      "title": "Auditoría de Stack",
      "desc": "Utilizar herramientas de detección de stack para identificar posibles fricciones o dependencias tecnológicas.",
      "output": "Mapa de infraestructura digital"
    },
    {
      "title": "Inferencia de Talento",
      "desc": "Revisar vacantes activas para deducir qué capacidades faltan internamente.",
      "output": "Hipótesis de brecha de talento"
    },
    {
      "title": "Perfilado de Liderazgo",
      "desc": "Analizar la huella digital de los tomadores de decisión para comprender su estilo de comunicación.",
      "output": "Perfil psicográfico del liderazgo"
    },
    {
      "title": "Sintetización Macro",
      "desc": "Solicitar a la IA la identificación de los 3 retos macroeconómicos que más presionan al sector.",
      "output": "Matriz de presión sectorial"
    },
    {
      "title": "Generación de Hipótesis",
      "desc": "Generar 3 ángulos de abordaje diferentes basados en los dolores específicos detectados.",
      "output": "Estrategia de entrada multi-ángulo"
    },
    {
      "title": "Creación de Icebreakers",
      "desc": "Redactar frases de apertura personalizadas de alta relevancia.",
      "output": "Guion de apertura de alta conversión"
    },
    {
      "title": "Compilación de Dossier",
      "desc": "Compilar toda la inteligencia en un One-Pager estructurado para ventaja estratégica total.",
      "output": "Dossier de inteligencia comercial"
    }
  ],
  "vitamin": "La IA no reemplaza al vendedor; lo convierte en un estratega omnisciente. Investiga 10 veces más para contactar 10 veces mejor.",
  "standard": "Sovereign Sales Flow | Bottom-Up Standard"
}