{
  "$schema": "../../templates/playbook-ritual-schema.json",
  "meta": {
    "id": "calificar-oportunidad-b2b-ritual",
    "segment": "empresas-b2b",
    "sop": "sop-discovery",
    "version": "v3.0.0",
    "standard": "Sovereign Gold Master",
    "lastUpdated": "2026-02-19"
  },
  "playbook": {
    "title": "Calificar Oportunidad B2B",
    "subtitle": "The Sovereign Decision Logic",
    "docType": "Playbook Operativo",
    "sopPhase": "Discovery",
    "breadcrumb": [
      "MetodologIA",
      "Proceso Comercial",
      "SOP Discovery",
      "Calificar Oportunidad"
    ],
    "tldr": {
      "hook": "¿Es esta oportunidad un motor de crecimiento o un drenaje de tiempo?",
      "summary": "Este ritual permite aplicar el rigor de MEDDIC para filtrar cuentas y priorizar recursos en las ventas con mayor probabilidad de cierre.",
      "time": "~15 min",
      "mainOutput": "Opportunity Scoring Card"
    },
    "objective": "Determinar la viabilidad técnica y financiera de la cuenta aplicando la matriz de scoring MEDDIC para proteger la soberanía operativa."
  },
  "glossary": [
    {
      "term": "MEDDIC",
      "definition": "Métrica, Economic Buyer, Decision Criteria, Decision Process, Identify Pain, Champion. Estándar de calificación B2B."
    },
    {
      "term": "Champion",
      "definition": "Persona dentro de la empresa cliente con influencia y poder que vende la solución internamente."
    },
    {
      "term": "Economic Buyer",
      "definition": "La persona que tiene el control del presupuesto y el poder de firma final."
    },
    {
      "term": "Burning Flag",
      "definition": "El problema crítico que obliga al cliente a actuar de inmediato por miedo a consecuencias graves."
    }
  ],
  "steps": [
    {
      "title": "Verificación de Fit ICP",
      "desc": "Validamos ingresos, stack y equipo contra el perfil de cliente ideal.",
      "output": "ICP_STATUS: [VIP / Target / Avoid]"
    },
    {
      "title": "Detección de Dolor Crítico",
      "desc": "Confirmamos si el problema es una 'aspirina' o una 'vitamina'.",
      "output": "PAIN: El cliente pierde [Dato] por no resolver [Problema]."
    },
    {
      "title": "Prompt: Auditoría de Discovery",
      "desc": "Inyectamos las notas en la IA para detectar inconsistencias.",
      "output": "PROMPT: Actúa como un Auditor de Riesgos Ventas. Analiza este discovery: [Texto]. Identifica contradicciones y califica la urgencia real del 1 al 10."
    },
    {
      "title": "Mapa de Autoridad (DM)",
      "desc": "Identificamos quién firma el cheque realmente.",
      "output": "DM: [Nombre/Rol] tiene el poder de firma presupuestal."
    },
    {
      "title": "Validación del Champion",
      "desc": "¿Tenemos a nuestro aliado interno identificado?",
      "output": "CHAMPION: [Nombre] ha validado el valor técnico del proyecto."
    },
    {
      "title": "Verificación de Timeline",
      "desc": "¿Hay una fecha dura de cierre basada en un evento externo?",
      "output": "EVENTO: El proyecto debe estar listo para [Fecha] por [Hito]."
    },
    {
      "title": "Escrutinio de Competencia",
      "desc": "¿Contra quién estamos compitiendo realmente (incluyendo el hacerlo manual)?",
      "output": "COMPETENCIA: El cliente evalúa a [Rival] y el criterio decisor es [X]."
    },
    {
      "title": "Validación de Presupuesto",
      "desc": "¿Hay dinero real asignado a este dolor?",
      "output": "BANT: Presupuesto [Asignado/Por Definir] para el ciclo [Q]."
    },
    {
      "title": "Cálculo de Scoring Maestro",
      "desc": "Asignamos puntos MEDDIC para obtener el score de salud.",
      "output": "SCORE: [Sumatoria 0-100]. Medido bajo estándar Gold Master."
    },
    {
      "title": "Clasificación y Bridge",
      "desc": "Activamos el siguiente paso (Contrato o Nurturing).",
      "output": "ACCION: Mover a [Fase Contractual] en CRM."
    }
  ],
  "vitamin": "Ignorar las señales de alerta en la calificación es planear el fracaso en el cierre. Califica duro para cerrar fácil.",
  "standard": "MetodologIA Sovereign Gold | v3.0"
}