{
  "$schema": "../../../../templates/playbook-ritual-schema.json",
  "meta": {
    "id": "preparar-business-case-b2b-ritual",
    "segment": "empresas-b2b",
    "sop": "sop-discovery",
    "version": "v4.5 (High-Density)",
    "standard": "Moat Certified",
    "lastUpdated": "2026-02-16"
  },
  "playbook": {
    "title": "Business Case B2B",
    "subtitle": "The ROI Engine",
    "docType": "Playbook Operativo",
    "sopPhase": "Discovery",
    "breadcrumb": [
      "MetodologIA",
      "Proceso Comercial",
      "SOP Discovery",
      "Business Case B2B"
    ],
    "tldr": {
      "hook": "Define la pregunta crítica que este ritual resuelve.",
      "summary": "Resumen ejecutivo de 3 líneas sobre el propósito y resultado esperado.",
      "time": "~30 min",
      "mainOutput": "ROI Deck"
    },
    "objective": "Demostrar que nuestra solución no es un costo, sino una inversión con retorno positivo garantizado."
  },
  "glossary": [
    {
      "term": "Payback Period",
      "definition": "Tiempo necesario para recuperar la inversión inicial."
    },
    {
      "term": "NPV (Net Present Value)",
      "definition": "El valor hoy de los flujos de dinero futuros del proyecto."
    },
    {
      "term": "TCO (Total Cost of Ownership)",
      "definition": "Costo total de adquisición, operación y mantenimiento."
    },
    {
      "term": "Value Levers",
      "definition": "Los 3 palancas macro que generan ahorro o ingreso nuevo."
    }
  ],
  "steps": [
    {
      "title": "Identificación de Levers",
      "desc": "¿Dónde ganan más dinero con Moat?",
      "output": "Lever Matrix"
    },
    {
      "title": "Cálculo de Ahorros",
      "desc": "Estimar reducción de tiempos y errores.",
      "output": "Saving Model"
    },
    {
      "title": "Proyección I. Nuevos",
      "desc": "Modelar crecimiento de ventas gracias a la solución.",
      "output": "Growth Model"
    },
    {
      "title": "Cálculo de TCO",
      "desc": "Listar licencias, servicios y mantenimiento.",
      "output": "Cost Table"
    },
    {
      "title": "Modelado de ROI",
      "desc": "Calcular (Retorno - Inversión) / Inversión.",
      "output": "ROI Formula"
    },
    {
      "title": "Análisis de Payback",
      "desc": "¿En cuántos meses llegamos al Break-even?",
      "output": "Payback Chart"
    },
    {
      "title": "Análisis de Riesgos",
      "desc": "¿Qué pasa si solo logramos el 50% del ROI?",
      "output": "Sensitivity Analysis"
    },
    {
      "title": "Executive Summary ROI",
      "desc": "Un párrafo demoledor para el CFO.",
      "output": "CFO Hook"
    },
    {
      "title": "Validación de Datos",
      "desc": "Confirmar números con el Sponsor.",
      "output": "Data Sign-off"
    },
    {
      "title": "Final Board Deck",
      "desc": "Presentación visual del caso de negocio.",
      "output": "ROI Deck"
    }
  ],
  "vitamin": "Sin ROI no hay presupuesto. El Business Case es el arma que el Sponsor usa para convencer al CFO.",
  "standard": "Atomic Step 10/10 | Logic: ROI-Led Decisions"
}