{
  "$schema": "../../templates/playbook-ritual-schema.json",
  "meta": {
    "id": "proponer-esquema-aliado-ritual",
    "segment": "aliados-gtm",
    "sop": "sop-alianzas",
    "version": "v3.1.0",
    "standard": "Sovereign Gold Master",
    "lastUpdated": "2026-02-19"
  },
  "playbook": {
    "title": "Proponer Esquema de Alianza",
    "subtitle": "The Value Architect",
    "docType": "Playbook Operativo",
    "sopPhase": "Partners",
    "breadcrumb": [
      "MetodologIA",
      "Proceso Comercial",
      "SOP Alianzas",
      "Proponer Esquema"
    ],
    "tldr": {
      "hook": "El valor percibido debe ser 9 veces mayor al esfuerzo.",
      "summary": "Este ritual co-diseña el modelo económico y operativo que garantiza rentabilidad masiva para ambas partes.",
      "time": "~30 min",
      "mainOutput": "Partner Agreement Draft"
    },
    "objective": "Configurar un esquema de incentivos y responsabilidades que acelere la tracción comercial."
  },
  "glossary": [
    {
      "term": "Ancla de Valor",
      "definition": "El beneficio principal que el aliado más valora (ej. prestigio, dinero, tiempo)."
    },
    {
      "term": "Split de Comisión",
      "definition": "Porcentaje de distribución de ingresos entre el aliado y MetodologIA según su rol."
    }
  ],
  "steps": [
    {
      "title": "Split Analysis",
      "desc": "Configuramos el reparto (Referidor vs implementador) basado en roles.",
      "output": "MATH: Modelo económico definido."
    },
    {
      "title": "Matriz RACI Partners",
      "desc": "Definimos quién da la cara al cliente y quién hace el soporte técnico.",
      "output": "RACI: Responsabilidades operativas claras."
    },
    {
      "title": "Roadmap de Incentivos",
      "desc": "Proponemos 3 hitos de escalado para desbloquear beneficios únicos.",
      "output": "PATH: Scaling Roadmap diseñado."
    },
    {
      "title": "Redacción Sovereign",
      "desc": "Creamos el borrador del acuerdo usando el estándar Neo-Swiss (No Legalese).",
      "output": "DRAFT: Acuerdo Win-Win redactado."
    },
    {
      "title": "Coach de Pitch",
      "desc": "IA entrena al DRI para manejar las objeciones típicas del aliado potencial.",
      "output": "PITCH: Guion de negociación listo."
    },
    {
      "title": "Cláusulas de Exclusividad",
      "desc": "Ajustamos territorios o nichos protegidos basados en compromiso de facturación.",
      "output": "POLICY: Política de exclusividad definida."
    },
    {
      "title": "Auditoría de Pagos",
      "desc": "Definimos net-15 o net-30 y procesos de verificación mutua.",
      "output": "PAY: Ventanas de pago acordadas."
    },
    {
      "title": "Partner Dashboard",
      "desc": "Diseñamos la vista de transparencia que el aliado usará para ver su dinero.",
      "output": "VIEW: Estructura de dashboard aprobada."
    },
    {
      "title": "Validation 9:1",
      "desc": "Confirmamos que el aliado siente un beneficio masivo inmediato.",
      "output": "CHECK: Ratio de valor validado."
    },
    {
      "title": "Acceptance Handoff",
      "desc": "Obtenemos el 'GO' verbal y preparamos para la firma oficial.",
      "output": "DOC: Propuesta aceptada."
    }
  ],
  "vitamin": "No negocies por el 1% de hoy, negocia por el 100% de la confianza de mañana.",
  "standard": "MetodologIA Sovereign Gold | v3.1"
}
