{
  "$schema": "../../../../templates/playbook-ritual-schema.json",
  "meta": {
    "id": "auditar-map-b2b-ritual",
    "segment": "empresas-b2b",
    "sop": "sop-structuring",
    "version": "V4.5 (HIGH-DENSITY)",
    "standard": "Moat Certified",
    "lastUpdated": "2026-02-16"
  },
  "playbook": {
    "title": "MAP Audit (Consensus Check)",
    "subtitle": "The Consensus Ritual",
    "docType": "Playbook Operativo",
    "sopPhase": "Structuring",
    "breadcrumb": [
      "MetodologIA",
      "Proceso Comercial",
      "SOP Structuring",
      "MAP Audit (Consensus Check)"
    ],
    "tldr": {
      "hook": "Define la pregunta crítica que este ritual resuelve.",
      "summary": "Resumen ejecutivo de 3 líneas sobre el propósito y resultado esperado.",
      "time": "~30 min",
      "mainOutput": "Deal Health Score"
    },
    "objective": "Auditar la salud del Consenso (No del CRM) para asegurar la viabilidad del cierre."
  },
  "glossary": [
    {
      "term": "Mutual Action Plan (MAP)",
      "definition": "Documento compartido que alinea los hitos del cliente con los hitos del proveedor."
    },
    {
      "term": "Sponsor",
      "definition": "El aliado interno que arriesga su reputación por el proyecto."
    },
    {
      "term": "Weekly Progress Memo",
      "definition": "Reporte de 3 puntos enviado al Sponsor para mantener el ritmo del deal."
    }
  ],
  "steps": [
    {
      "title": "Stakeholder Health Check",
      "desc": "Identificar roles faltantes (EB, TS).",
      "output": "Identified Gaps"
    },
    {
      "title": "Timeline Validation",
      "desc": "Cruzar fechas del MAP vs realidad.",
      "output": "Lag Analysis"
    },
    {
      "title": "Value Confirmation",
      "desc": "Validar si el dolor sigue siendo prioridad.",
      "output": "Value Affirmation"
    },
    {
      "title": "Budget Pulse",
      "desc": "Confirmar que el presupuesto sigue asignado.",
      "output": "Funding Status"
    },
    {
      "title": "Political Landscape Review",
      "desc": "Detectar nuevos bloqueadores o promotores.",
      "output": "Org Map update"
    },
    {
      "title": "Next Step Precision",
      "desc": "Definir la acción exacta para las próximas 48h.",
      "output": "Action Item"
    },
    {
      "title": "CRM Sync",
      "desc": "Actualizar Forecast basado en la salud del MAP.",
      "output": "Forecast update"
    },
    {
      "title": "Drafting the Weekly Memo",
      "desc": "Redactar resumen de avances.",
      "output": "Weekly Draft"
    },
    {
      "title": "Role Alignment (Internal)",
      "desc": "Definir quién rescata hitos retrasados.",
      "output": "Team assignment"
    },
    {
      "title": "Final Score",
      "desc": "Calificar el deal (Salud: Verde/Ambar/Rojo).",
      "output": "Deal Health Score"
    }
  ],
  "vitamin": "El CRM es una mentira conveniente; el MAP es la verdad incómoda. Audita el consenso, no el software.",
  "standard": "Atomic Step 10/10 | Logic: Consensus Audit"
}