{
  "$schema": "../../templates/playbook-ritual-schema.json",
  "meta": {
    "id": "mapear-iq-tecnico-ritual",
    "segment": "empresas-b2b",
    "sop": "sop-structuring",
    "version": "v3.0.0",
    "standard": "Sovereign Gold Master",
    "lastUpdated": "2026-02-19"
  },
  "playbook": {
    "title": "Mapear IQ Técnico",
    "subtitle": "The Solution Blueprint",
    "docType": "Playbook Operativo",
    "sopPhase": "Structuring",
    "breadcrumb": [
      "MetodologIA",
      "Proceso Comercial",
      "SOP Structuring",
      "Mapear IQ Técnico"
    ],
    "tldr": {
      "hook": "No diseñes una solución, diseña un ecosistema de valor.",
      "summary": "Este ritual permite traducir requisitos en una arquitectura viable, auditar la deuda técnica y mitigar riesgos antes de proponer.",
      "time": "~40 min",
      "mainOutput": "Architectural Blueprint"
    },
    "objective": "Traducir los dolores de negocio en una arquitectura técnica sólida, minimizando la deuda técnica y garantizando la viabilidad de la implementación."
  },
  "glossary": [
    {
      "term": "Deuda Técnica",
      "definition": "El costo futuro de retrabajo causado por elegir una solución fácil ahora en lugar de una mejor opción que toma más tiempo."
    },
    {
      "term": "C4 Model",
      "definition": "Estándar para diagramar arquitecturas de software en niveles (Contexto, Contenedores, Componentes, Código)."
    },
    {
      "term": "API First",
      "definition": "Enfoque de diseño que prioriza la integración y comunicación entre sistemas desde el inicio."
    },
    {
      "term": "Día 2",
      "definition": "El estado operativo de una solución una vez que ha sido desplegada y requiere mantenimiento y escala."
    }
  ],
  "steps": [
    {
      "title": "Auditoría de Requisitos",
      "desc": "Filtramos los inputs del Discovery para separar lo innegociable de lo cosmético.",
      "output": "REQUISITOS: Definidos los 3 Must-Haves arquitectónicos."
    },
    {
      "title": "Mapeo de Integraciones",
      "desc": "Identificamos los puentes necesarios con el stack actual del cliente.",
      "output": "API MAP: Lista de endpoints y flujos de datos requeridos."
    },
    {
      "title": "Prompt: Analista de Deuda",
      "desc": "Usamos IA para detectar riesgos en el stack del cliente.",
      "output": "PROMPT: Analiza este Stack: [Lista]. Identifica los 3 cuellos de botella más probables que impedirán la escalabilidad y sugiere una mitigación."
    },
    {
      "title": "Selección del Stack Core",
      "desc": "Elegimos las tecnologías base que garantizan rentabilidad y escala.",
      "output": "STACK: [Tecnologías] seleccionadas para la implementación."
    },
    {
      "title": "Diagramación del Blueprint",
      "desc": "Creamos el visual C4 Level 1 para que el Decisor vea el 'Cómo'.",
      "output": "BLUEPRINT: Diagrama de arquitectura de alto nivel generado."
    },
    {
      "title": "Check de Compliance",
      "desc": "¿El diseño cumple con seguridad y regulaciones (GDPR/SOC2)?",
      "output": "COMPLIANCE: Diseño validado contra estándares de seguridad."
    },
    {
      "title": "Diseño 'Day 2'",
      "desc": "Planificamos cómo se mantendrá y escalará la solución post-entrega.",
      "output": "DAY 2: Definida la estrategia de soporte y escalabilidad."
    },
    {
      "title": "Estimación de Complejidad",
      "desc": "Calculamos el nivel de esfuerzo técnico preliminar para Operaciones.",
      "output": "IQ SCORE: Nivel de complejidad [1-5] asignado."
    },
    {
      "title": "Prompt: QA de Solución",
      "desc": "Simulamos una crítica técnica del CTO para blindar el diseño.",
      "output": "PROMPT: Actúa como el CTO del Cliente. Encuentra 2 fallas lógicas en esta arquitectura [Descripción] y propone una solución más robusta."
    },
    {
      "title": "Engineering Sign-off",
      "desc": "Validación final y carga al CRM para la fase de cierre.",
      "output": "SIGN-OFF: Arquitectura validada y lista para propuesta."
    }
  ],
  "vitamin": "Una arquitectura sólida no solo resuelve el problema de hoy, evita la pesadilla de soporte de mañana.",
  "standard": "MetodologIA Sovereign Gold | v3.0"
}
