{
  "$schema": "../../templates/playbook-ritual-schema.json",
  "meta": {
    "id": "transferencia-confianza-ritual",
    "segment": "empresas-b2b",
    "sop": "sop-success-delivery",
    "version": "v3.0.0",
    "standard": "Sovereign Gold Master",
    "lastUpdated": "2026-02-19"
  },
  "playbook": {
    "title": "Transferencia de Confianza",
    "subtitle": "The Referral Engine",
    "docType": "Playbook Operativo",
    "sopPhase": "Success",
    "breadcrumb": [
      "MetodologIA",
      "Proceso Comercial",
      "SOP Success",
      "Referral"
    ],
    "tldr": {
      "hook": "La confianza no se compra, se transfiere.",
      "summary": "Este ritual permite activar el 'Voz a Voz' de forma estructural, solicitando introducciones calificadas a la red íntima del cliente para alimentar el pipeline con leads cálidos.",
      "time": "~20 min",
      "mainOutput": "Warm Referrals"
    },
    "objective": "Activar el 'Voz a Voz' de forma estructural, solicitando 3 introducciones calificadas a contactos del círculo íntimo del cliente."
  },
  "glossary": [
    {
      "term": "Social IQ",
      "definition": "Nivel de influencia y autoridad que una persona tiene dentro de su red profesional para validar una solución ante terceros."
    },
    {
      "term": "Trust Transfer",
      "definition": "Acto psicológico donde un cliente satisfecho presta su credibilidad a MetodologIA para facilitar la entrada a un nuevo prospecto."
    },
    {
      "term": "Referral Box",
      "definition": "Toolkit de activos (mensajes, links, visuales) que facilitamos al cliente para que recomiende el servicio con cero esfuerzo."
    },
    {
      "term": "Lookalike Audit",
      "definition": "Proceso de filtrado para asegurar que los referidos tengan un perfil similar a nuestros mejores casos de éxito."
    }
  ],
  "steps": [
    {
      "title": "Referral Hunt (LinkedIn)",
      "desc": "Identificamos 3 contactos específicos en la red del cliente que encajen en nuestro ICP.",
      "output": "TARGETS: Lista de 3 perfiles para la petición de intro."
    },
    {
      "title": "Prompt: Social IQ Auditor",
      "desc": "IA perfila a los contactos y detecta sus dolores probables para personalizar la intro.",
      "output": "PROMPT: Analiza estos 3 perfiles. Identifica quién necesita [X] y redacta el 'Trigger de Interés'."
    },
    {
      "title": "Bridge Call Prep",
      "desc": "Definimos el momento exacto de la sesión de cierre para la petición.",
      "output": "AGENDA: Espacio de referral bloqueado en la reunión final."
    },
    {
      "title": "Anclaje de Gratitud",
      "desc": "Iniciamos reconociendo el éxito compartido para activar la reciprocidad.",
      "output": "RECIPROCIDAD: Clima de confianza activado ante el cliente."
    },
    {
      "title": "Petición 1% Trust",
      "desc": "Solicitamos la transferencia de confianza via Slack o WhatsApp de forma directa.",
      "output": "COMPROMISO: Acuerdo verbal para realizar las 3 introducciones."
    },
    {
      "title": "Prompt: Intro Script Gen",
      "desc": "IA genera los mensajes listos para copiar y pegar según el tono del cliente.",
      "output": "PROMPT: Genera mensaje de WhatsApp que [Cliente] enviaría a [Referido]. Tono: Colega cercano."
    },
    {
      "title": "Referral Context Sync",
      "desc": "Preparamos el dossier del lead referido con base en la relación con el cliente.",
      "output": "DOSSIER: Contexto de venta cálida listo para seguimiento."
    },
    {
      "title": "IQ Upgrade Incentive",
      "desc": "Premiamos la confianza del cliente con upgrades de inteligencia, no descuentos.",
      "output": "BONUS: Beneficio adicional activado en la cuenta del referente."
    },
    {
      "title": "Lookalike Audit",
      "desc": "Filtramos al referido para asegurar que es un prospecto de alta calidad.",
      "output": "VALIDACIÓN: Referido confirmado como ICP Nivel 1."
    },
    {
      "title": "CRM Loop Closure",
      "desc": "Sincronizamos al lead y mantenemos informado al referente de los avances.",
      "output": "CRM: Nuevo lead cálido registrado y loop de gratitud cerrado."
    }
  ],
  "vitamin": "Un referido es una venta cerrada al 50%. Trátalo con la misma delicadeza con la que el cliente te prestó su nombre.",
  "standard": "MetodologIA Sovereign Gold | v3.0"
}
