{
  "$schema": "../../templates/playbook-ritual-schema.json",
  "meta": {
    "id": "mapear-stakeholders-b2b-ritual",
    "segment": "empresas-b2b",
    "sop": "sop-scouting",
    "version": "v3.0.0",
    "standard": "Sovereign Gold Master",
    "lastUpdated": "2026-02-19"
  },
  "playbook": {
    "title": "Mapear Stakeholders B2B",
    "subtitle": "The Sovereign Influence Map",
    "docType": "Playbook Operativo",
    "sopPhase": "Scouting",
    "breadcrumb": [
      "MetodologIA",
      "Proceso Comercial",
      "SOP Scouting",
      "Mapear Stakeholders"
    ],
    "tldr": {
      "hook": "¿Quién firma el cheque y quién tiene el poder real en la sombra?",
      "summary": "Este ritual permite mapear el comité de compras antes del primer contacto para evitar 'gatekeepers' y alinear el mensaje con el sesgo de decisión de cada rol.",
      "time": "~15 min",
      "mainOutput": "Influence Map Card"
    },
    "objective": "Visualizar el Comité de Compras y la red de influencia interna para navegar la cuenta con precisión quirúrgica y evitar bloqueos de última hora."
  },
  "glossary": [
    {
      "term": "Economic Buyer",
      "definition": "Persona con autoridad final sobre el presupuesto (C-Level / Dir. General)."
    },
    {
      "term": "User Champion",
      "definition": "El usuario avanzado que más se beneficia de la solución y la vende internamente."
    },
    {
      "term": "Technical Steward",
      "definition": "Responsable de evaluar riesgos técnicos, de seguridad o legales."
    },
    {
      "term": "Sesgo de Decisión",
      "definition": "La inclinación psicológica del stakeholder (averso al riesgo, innovador, obsesionado con costos)."
    }
  ],
  "steps": [
    {
      "title": "Escaneo Departamental",
      "desc": "Identificamos el área que custodia el proceso que queremos automatizar.",
      "output": "ÁREA: El proceso de [X] está bajo el mando de [Departamento]."
    },
    {
      "title": "Identificación del EB",
      "desc": "Localizamos al dueño del presupuesto de la unidad de negocio.",
      "output": "EB: [Nombre/Rol] es el Economic Buyer identificado."
    },
    {
      "title": "Localización del UC",
      "desc": "Buscamos a quien lidera el equipo operativo diariamente.",
      "output": "UC: [Nombre/Rol] es el User Champion potencial."
    },
    {
      "title": "Detección del TS",
      "desc": "Identificamos quién pondrá las trabas técnicas (IT/Seguridad).",
      "output": "TS: [Nombre/Rol] es el Technical Steward a gestionar."
    },
    {
      "title": "Análisis de Tenure",
      "desc": "¿Lleva poco tiempo en el cargo? Es un momento ideal para proponer cambios.",
      "output": "WINDOW: [Stakeholder] lleva [Meses] en el cargo. Alta receptividad."
    },
    {
      "title": "Prompt: Sesgo de Decisión",
      "desc": "Usamos IA para perfilar el tono del mensaje.",
      "output": "PROMPT: Analiza este perfil de LinkedIn: [Texto]. Identifica su 'Sesgo de Decisión' y sugiere un ángulo de aproximación que no sea de ventas."
    },
    {
      "title": "Matriz de Dolores Cruzados",
      "desc": "Mapeamos qué le duele específicamente a cada uno de los 3 perfiles.",
      "output": "PAINS: EB (ROI), UC (Tiempo), TS (Seguridad)."
    },
    {
      "title": "Estrategia de Outreach",
      "desc": "Elegimos si entramos vía Director (Top-Down) o vía Gerente (Bottom-Up).",
      "output": "ROUTE: Empezar contacto vía [Stakeholder] con ángulo [Tipo]."
    },
    {
      "title": "Validación de Puentes",
      "desc": "¿Tenemos algún ex-compañero o cliente previo que conozca la cuenta?",
      "output": "PUENTE: [Nombre] puede hacernos la introducción a [Stakeholder]."
    },
    {
      "title": "Sincronización final CRM",
      "desc": "Guardamos el organigrama de influencia para toda la cuenta.",
      "output": "CRM: Organigrama cargado. Listos para Outreach."
    }
  ],
  "vitamin": "En las grandes ventas B2B, no le vendes a una persona, le vendes a una RED. Si no tienes el mapa, estás perdido en el bosque.",
  "standard": "MetodologIA Sovereign Gold | v3.0"
}