{
  "$schema": "../../../../templates/playbook-ritual-schema.json",
  "meta": {
    "id": "calificar-oportunidad-b2b-ritual",
    "segment": "empresas-b2b",
    "sop": "sop-scouting",
    "version": "v2.1.0",
    "standard": "Moat Certified",
    "lastUpdated": "2026-02-16"
  },
  "playbook": {
    "title": "Calificar Oportunidad B2B",
    "subtitle": "The Qualification Gate Ritual",
    "docType": "Playbook Operativo",
    "sopPhase": "Scouting",
    "breadcrumb": [
      "MetodologIA",
      "Proceso Comercial",
      "SOP Scouting",
      "Calificar Oportunidad B2B"
    ],
    "tldr": {
      "hook": "Define la pregunta crítica que este ritual resuelve.",
      "summary": "Resumen ejecutivo de 3 líneas sobre el propósito y resultado esperado.",
      "time": "~30 min",
      "mainOutput": "Bitácora de decisión comercial"
    },
    "objective": "Determina rigurosamente si la cuenta cumple con los criterios de éxito para invertir recursos de preventa y arquitectura."
  },
  "glossary": [
    {
      "term": "ICP (Ideal Customer Profile)",
      "definition": "Perfil de Cliente Ideal. Conjunto de características (industria, facturación, stack técnico) que definen a la empresa que más se beneficia."
    },
    {
      "term": "Champion",
      "definition": "Aliado interno dentro de la empresa cliente que impulsa la adopción de nuestra solución."
    },
    {
      "term": "Decision Maker",
      "definition": "Figura con autoridad real y control de presupuesto para firmar el contrato final."
    },
    {
      "term": "Scoring",
      "definition": "Sistema de puntuación numérica que pondera variables como urgencia y fit para priorizar la atención."
    }
  ],
  "steps": [
    {
      "title": "Verificación ICP",
      "desc": "Confirmar tamaño de la empresa, industria específica e ingresos mínimos viables según nuestro estándar actual.",
      "output": "Checklist de fit estratégico completo"
    },
    {
      "title": "Dolor Activo",
      "desc": "Validar si existe un problema crítico que necesiten resolver en el corto plazo o si es una exploración pasiva.",
      "output": "Declaración del dolor principal"
    },
    {
      "title": "Mapeo de Autoridad",
      "desc": "Identificar claramente quién es el Champion y quién es el Decision Maker real del proyecto.",
      "output": "Matriz inicial de poder"
    },
    {
      "title": "Timeline",
      "desc": "Definir la ventana temporal de implementación (Q1, Q2, o estado latente) para proyectar el cierre.",
      "output": "Fecha estimada de decisión"
    },
    {
      "title": "Presupuesto",
      "desc": "Sondear sutilmente la partida asignada o la capacidad de inversión para este tipo de iniciativas.",
      "output": "Rango presupuestal estimado"
    },
    {
      "title": "Competencia",
      "desc": "Identificar con qué otros proveedores o soluciones internas están comparando nuestra propuesta.",
      "output": "Análisis de ventaja competitiva"
    },
    {
      "title": "Validación Técnica",
      "desc": "Asegurar compatibilidad absoluta con su stack tecnológico actual para evitar bloqueos finales.",
      "output": "Confirmación de viabilidad técnica"
    },
    {
      "title": "Scoring Comercial",
      "desc": "Asignar un puntaje (1-100) basado en la urgencia detectada y el fit total con nuestros servicios.",
      "output": "Calificación numérica"
    },
    {
      "title": "Decisión de Flujo",
      "desc": "Ejecutar acción final: Avanzar a Discovery (>70) o mover a flujo de Nurturing (<50).",
      "output": "Cambio de estatus en ventas"
    },
    {
      "title": "Registro en CRM",
      "desc": "Guardar el razonamiento detallado de la calificación para futuras revisiones de inteligencia.",
      "output": "Bitácora de decisión comercial"
    }
  ],
  "vitamin": "Calificar no es excluir; es priorizar para ganar. La descalificación temprana es el mayor ahorro de OPEX en una empresa B2B.",
  "standard": "Sovereign Sales Flow | Bottom-Up Standard"
}