{
  "$schema": "../../../../templates/playbook-ritual-schema.json",
  "meta": {
    "id": "validar-solucion-b2b-ritual",
    "segment": "empresas-b2b",
    "sop": "sop-discovery",
    "version": "v4.5 (High-Density)",
    "standard": "Moat Certified",
    "lastUpdated": "2026-02-16"
  },
  "playbook": {
    "title": "Validar Solución B2B",
    "subtitle": "The Consensus Ritual",
    "docType": "Playbook Operativo",
    "sopPhase": "Discovery",
    "breadcrumb": [
      "MetodologIA",
      "Proceso Comercial",
      "SOP Discovery",
      "Validar Solución B2B"
    ],
    "tldr": {
      "hook": "Define la pregunta crítica que este ritual resuelve.",
      "summary": "Resumen ejecutivo de 3 líneas sobre el propósito y resultado esperado.",
      "time": "~30 min",
      "mainOutput": "Green Light"
    },
    "objective": "Asegurar que el cliente acepta técnica y políticamente el diseño propuesto antes de enviar la oferta económica."
  },
  "glossary": [
    {
      "term": "Technical Sign-off",
      "definition": "Aprobación del arquitecto o CTO del cliente sobre la viabilidad técnica."
    },
    {
      "term": "Consensus Building",
      "definition": "El arte de alinear a los diferentes departamentos detrás de una sola solución."
    },
    {
      "term": "Objection Handling",
      "definition": "Convertir las dudas del cliente en requerimientos técnicos específicos."
    },
    {
      "term": "Proof of Concept (PoC)",
      "definition": "Demostración mínima viable de una funcionalidad crítica para reducir el miedo al riesgo."
    }
  ],
  "steps": [
    {
      "title": "Presentación de Arquitectura",
      "desc": "Explicar el C4 Model al equipo técnico.",
      "output": "Tech Alignment"
    },
    {
      "title": "Mapeo de Requerimientos",
      "desc": "Cruzar la solución con los Must-Haves iniciales.",
      "output": "Compliance Check"
    },
    {
      "title": "Identificación de 'Gaps'",
      "desc": "¿Qué falta para que digan 'Sí' ahora?",
      "output": "Gap Log"
    },
    {
      "title": "Sesión de QA Técnico",
      "desc": "Resolver dudas de performance y seguridad.",
      "output": "Security Sign-off"
    },
    {
      "title": "Validación de Workflow",
      "desc": "Simular el Día 2 con los usuarios finales.",
      "output": "UX Validation"
    },
    {
      "title": "Acuerdo de Alcance (Scope)",
      "desc": "Fijar límites de lo que se construye y lo que no.",
      "output": "Scope Freeze"
    },
    {
      "title": "Confirmación de Tiempos",
      "desc": "Validar si el cronograma propuesto es realista para ellos.",
      "output": "Timeline Audit"
    },
    {
      "title": "Identificación de DRI Cliente",
      "desc": "Saber quién será el responsable de su lado.",
      "output": "Counterpart ID"
    },
    {
      "title": "Sondeo Político",
      "desc": "Asegurar que los detractores han sido escuchados.",
      "output": "Political Health"
    },
    {
      "title": "OK para Envío Oferta",
      "desc": "Permiso explícito para enviar la propuesta formal.",
      "output": "Green Light"
    }
  ],
  "vitamin": "No vendas software; vende el resultado validado. Si el cliente no ve su logo en la solución, no la sentirá propia.",
  "standard": "Atomic Step 10/10 | Logic: Pre-Offer Consensus"
}