{
  "$schema": "../../templates/playbook-ritual-schema.json",
  "meta": {
    "id": "transferencia-iq-aliado-ritual",
    "segment": "aliados-gtm",
    "sop": "sop-onboarding-gtm",
    "version": "v3.0.0",
    "standard": "Sovereign Gold Master",
    "lastUpdated": "2026-02-19"
  },
  "playbook": {
    "title": "Transferencia de IQ",
    "subtitle": "The Partner IQ Sync",
    "docType": "Playbook Operativo",
    "sopPhase": "Onboarding",
    "breadcrumb": [
      "MetodologIA",
      "Ecosistema Aliados",
      "SOP Onboarding",
      "Transferencia de IQ"
    ],
    "tldr": {
      "hook": "Un aliado sin IQ es una carga. Uno sincronizado es un multiplicador.",
      "summary": "Este ritual permite equipar al aliado con la infraestructura, el contexto y los prompts necesarios para operar bajo el estándar MetodologIA de forma autónoma.",
      "time": "~40 min",
      "mainOutput": "Active Sovereign Partner"
    },
    "objective": "Equipar al Aliado con la propiedad intelectual y los activos de inteligencia necesarios para que su oferta local cumpla con el estándar MetodologIA."
  },
  "glossary": [
    {
      "term": "Sovereign Key",
      "definition": "Acceso total a los activos de inteligencia (Vault, Studio, Prompts) otorgado al aliado tras su certificación."
    },
    {
      "term": "Prompt Armor",
      "definition": "Paquete de instrucciones de IA optimizadas para el nicho específico del aliado que protegen la calidad del output."
    },
    {
      "term": "Shadow Run",
      "definition": "Ejecución supervisada donde el aliado crea un artefacto real bajo la auditoría de MetodologIA."
    },
    {
      "term": "ADN Aliado",
      "definition": "El conocimiento vertical y de mercado que el partner aporta y que se fusiona con el IQ de MetodologIA."
    }
  ],
  "steps": [
    {
      "title": "Provisionamiento Técnico",
      "desc": "Activamos credenciales en Vault y Studio para que el aliado esté 'Online'.",
      "output": "INFRA: Accesos activos para el equipo del aliado."
    },
    {
      "title": "Carga de ADN Sectorial",
      "desc": "Alimentamos el Notebook con datos específicos de la vertical del aliado.",
      "output": "CONTEXT: Datasets inyectados en el entorno de trabajo."
    },
    {
      "title": "Sincronización Ontológica",
      "desc": "Validamos que el aliado entienda y use el glosario maestro correctamente.",
      "output": "ONTOLOGÍA: Alineación de términos 'Signal' y 'Protocolo' validada."
    },
    {
      "title": "Prompt: Factor Multiplicador",
      "desc": "Demostramos el gap de valor entre su oferta previa y la oferta Sovereign.",
      "output": "PROMPT: Analiza este documento del aliado [X]. Identifica 3 áreas de 'Felicidonia' y reemplázalas con métricas de rigor."
    },
    {
      "title": "Handoff 'Prompt Armor'",
      "desc": "Entrega de las armas tácticas optimizadas para su nicho.",
      "output": "ARMOR: Paquete de prompts entregado y configurado."
    },
    {
      "title": "Acceso SPoC Sync",
      "desc": "Configuramos el canal de soporte directo para asegurar cero fricción.",
      "output": "CANAL: Slack/Discord compartido y SPoC asignado."
    },
    {
      "title": "Shadow Run (Co-Creación)",
      "desc": "Supervisamos la creación del primer artefacto real del aliado.",
      "output": "ARTIFACT1: Primer dossier generado por el aliado validado."
    },
    {
      "title": "Prompt: Local-Sovereign Voice",
      "desc": "Usamos IA para calibrar el tono del mensaje según la cultura local del aliado.",
      "output": "PROMPT: Toma esta hipótesis y adáptala para que suene como una recomendación de un colega local en [Nicho]."
    },
    {
      "title": "Test de Autonomía",
      "desc": "Verificamos que el aliado puede resolver problemas técnicos mínimos sin ayuda.",
      "output": "AUTONOMÍA: Prueba de estrés de prompts superada."
    },
    {
      "title": "Activación 'Sovereign Key'",
      "desc": "Sign-off final y notificación para el inicio de operaciones comerciales.",
      "output": "KEY: Partner certificado y en operación total."
    }
  ],
  "vitamin": "Un aliado no es un revendedor, es una extensión de nuestro IQ en un territorio específico. Trátalo como a un arquitecto.",
  "standard": "MetodologIA Sovereign Gold | v3.0"
}
