{
  "$schema": "../../templates/playbook-ritual-schema.json",
  "meta": {
    "id": "formalizar-aliado-gtm-ritual",
    "segment": "aliados-gtm",
    "sop": "sop-alianzas",
    "version": "v3.1.0",
    "standard": "Sovereign Gold Master",
    "lastUpdated": "2026-02-19"
  },
  "playbook": {
    "title": "Formalizar Aliado GTM",
    "subtitle": "The Final Implementation",
    "docType": "Playbook Operativo",
    "sopPhase": "Partners",
    "breadcrumb": [
      "MetodologIA",
      "Proceso Comercial",
      "SOP Alianzas",
      "Formalizar Aliado"
    ],
    "tldr": {
      "hook": "La formalización es el inicio de la confianza legal.",
      "summary": "Este ritual ejecuta la transición administrativa del aliado a miembro oficial de la red MetodologIA.",
      "time": "~20 min",
      "mainOutput": "Legal Agreement & Partner Onboarding"
    },
    "objective": "Asegurar que el aliado tenga todas las herramientas legales y operativas para empezar a operar."
  },
  "glossary": [
    {
      "term": "Anexo SLA",
      "definition": "Documento que especifica los niveles de servicio y soporte técnico que el aliado recibirá de MetodologIA."
    },
    {
      "term": "KYC (Know Your Customer)",
      "definition": "Proceso de verificación de identidad y legalidad para prevenir riesgos operativos."
    }
  ],
  "steps": [
    {
      "title": "Audit de Anexos",
      "desc": "Verificamos que comisiones y SLAs en el contrato coincidan con lo negociado.",
      "output": "LEGAL: Paquete contractual listo."
    },
    {
      "title": "Firma Digital",
      "desc": "Enviamos documentos vía plataforma oficial para firma inmediata.",
      "output": "SIGN: Contrato enviado para el 'Final Click'."
    },
    {
      "title": "Sincronización JSON",
      "desc": "Alta oficial en el inventario-canonico.json y bases de datos maestras.",
      "output": "SYNC: Aliado activo en el sistema."
    },
    {
      "title": "Provisioning Tech",
      "desc": "Creación de accesos a Slack, CRM y Portal de Partners.",
      "output": "ACCESS: Herramientas habilitadas."
    },
    {
      "title": "Welcome Pack",
      "desc": "Envío de kit digital de marca y guiones iniciales.",
      "output": "KIT: Bienvenida oficial realizada."
    },
    {
      "title": "Digital Identity",
      "desc": "Entrega de assets para LinkedIn y firmas de email (Cobranding).",
      "output": "ID: Identidad digital alineada."
    },
    {
      "title": "Compliance Check",
      "desc": "Auditoría final de antecedentes y ética comercial.",
      "output": "KYC: Cumplimiento verificado."
    },
    {
      "title": "Kickoff Planning",
      "desc": "Agendamos sesión para definir el roadmap de los primeros 90 días.",
      "output": "MEET: Sesión de arranque agendada."
    },
    {
      "title": "Cierre de Venta",
      "desc": "Activación de permisos en el cotizador soberano.",
      "output": "GO: Capacidad de facturación activa."
    },
    {
      "title": "Handoff to Success",
      "desc": "Transferencia de IQ completa al equipo de delivery y success.",
      "output": "SOP: Ticket de onboarding cerrado."
    }
  ],
  "vitamin": "Tu contrato es tu palabra escrita en código. Asegúrate de que cada coma fortalezca la alianza.",
  "standard": "MetodologIA Sovereign Gold | v3.1"
}
