{
  "$schema": "../../templates/playbook-ritual-schema.json",
  "meta": {
    "id": "auditoria-expansion-ritual",
    "segment": "empresas-b2b",
    "sop": "sop-success-delivery",
    "version": "v3.0.0",
    "standard": "Sovereign Gold Master",
    "lastUpdated": "2026-02-19"
  },
  "playbook": {
    "title": "Auditoría de Expansión",
    "subtitle": "The Upsell Catalyst",
    "docType": "Playbook Operativo",
    "sopPhase": "Success",
    "breadcrumb": [
      "MetodologIA",
      "Proceso Comercial",
      "SOP Success",
      "Auditoría Expansión"
    ],
    "tldr": {
      "hook": "La expansión no es vender más, es resolver mejor.",
      "summary": "Este ritual guía la detección de ineficiencias adyacentes durante el delivery para proponer extensiones de valor que aumenten el LTV del cliente.",
      "time": "~30 min",
      "mainOutput": "Expansion Opportunity (Upsell)"
    },
    "objective": "Detectar ineficiencias adyacentes durante la ejecución de un servicio para expandir el alcance y maximizar el valor para el cliente."
  },
  "glossary": [
    {
      "term": "Fricción Adyacente",
      "definition": "Problemas u obstáculos que surgen en procesos que no son el foco principal del proyecto actual pero que afectan el resultado global."
    },
    {
      "term": "LTV (LifeTime Value)",
      "definition": "El valor total que un cliente representa para la empresa durante toda la duración de su relación."
    },
    {
      "term": "Fast-Add Proposal",
      "definition": "Formato de propuesta simplificada diseñada para ser aprobada rápidamente como una extensión de un contrato existente."
    },
    {
      "term": "Lookalike Prospect",
      "definition": "Perfil de cliente potencial que comparte características clave con un cliente actual exitoso."
    }
  ],
  "steps": [
    {
      "title": "Revisión de Fricción",
      "desc": "Escaneamos las notas de reuniones anteriores buscando dolores no resueltos por el contrato actual.",
      "output": "PAIN: Lista de 3 dolores adyacentes detectados."
    },
    {
      "title": "Prompt: Analista de Upsell",
      "desc": "IA traduce quejas operativas en Business Cases de expansión.",
      "output": "PROMPT: Analiza estas quejas: [Texto]. Identifica cuál de nuestros servicios resolvería esto y redacta el argumento."
    },
    {
      "title": "Audit de Salud (NPS)",
      "desc": "¿Estamos en posición de pedir más? Verificamos la excelencia del delivery actual.",
      "output": "HEALTH: Luz verde para proponer expansión (Hitos en verde)."
    },
    {
      "title": "Mapeo de Sinergias",
      "desc": "Identificamos cómo el nuevo módulo reduce el esfuerzo de la fase actual.",
      "output": "SYNergy: Argumento de eficiencia operativa validado."
    },
    {
      "title": "Visual Prototyping",
      "desc": "Creamos un esquema rápido de la solución integrada para el cliente.",
      "output": "VISUAL: Prototipo de expansión listo para mostrar."
    },
    {
      "title": "Prompt: Hook de Venta",
      "desc": "IA redacta el mensaje de curiosidad (Soft Pitch) para el Champion.",
      "output": "PROMPT: Redacta un mensaje de 40 palabras que mencione: 'Noté que el proceso Y está frenando a tu equipo...'."
    },
    {
      "title": "Draft de Fast-Add",
      "desc": "Preparamos el anexo de contrato simplificado (extensión de OdT).",
      "output": "PROPOSAL: Propuesta de extensión lista para envío."
    },
    {
      "title": "Resource Matchmaking",
      "desc": "Validamos que MetodologIA tiene equipo para ejecutar la expansión.",
      "output": "STAFFING: Equipo de ejecución pre-asignado."
    },
    {
      "title": "B2B Absorption Check",
      "desc": "¿Tiene el equipo del cliente ancho de banda para este nuevo alcance?",
      "output": "VIABILIDAD: Confirmación de capacidad del cliente."
    },
    {
      "title": "Registro CRM",
      "desc": "Cargamos la nueva oportunidad y sincronizamos con el equipo comercial.",
      "output": "CRM: Oportunidad de Upsell abierta y traqueada."
    }
  ],
  "vitamin": "Expandir es la forma más pura de validación. Si el cliente quiere más de ti, es que tu IQ está funcionando.",
  "standard": "MetodologIA Sovereign Gold | v3.0"
}
