{
  "$schema": "../../../../templates/playbook-ritual-schema.json",
  "meta": {
    "id": "ejecutar-discovery-b2b-ritual",
    "segment": "empresas-b2b",
    "sop": "sop-discovery",
    "version": "v4.5 (High-Density)",
    "standard": "Moat Certified",
    "lastUpdated": "2026-02-16"
  },
  "playbook": {
    "title": "Ejecutar Discovery B2B",
    "subtitle": "The Deep Dive Meeting",
    "docType": "Playbook Operativo",
    "sopPhase": "Discovery",
    "breadcrumb": [
      "MetodologIA",
      "Proceso Comercial",
      "SOP Discovery",
      "Ejecutar Discovery B2B"
    ],
    "tldr": {
      "hook": "Define la pregunta crítica que este ritual resuelve.",
      "summary": "Resumen ejecutivo de 3 líneas sobre el propósito y resultado esperado.",
      "time": "~30 min",
      "mainOutput": "Next Meeting Lock"
    },
    "objective": "Convertir la reunión en una sesión de co-creación estratégica donde el cliente confie en nuestra visión."
  },
  "glossary": [
    {
      "term": "Discovery Script",
      "definition": "El flujo lógico de preguntas diseñadas para revelar problemas raíces."
    },
    {
      "term": "Deep Dive",
      "definition": "Inmersión técnica en un proceso específico del cliente."
    },
    {
      "term": "Soft Ask",
      "definition": "Solicitud sutil de información o compromiso al final de la sesión."
    },
    {
      "term": "Aha Moment",
      "definition": "El instante en que el cliente entiende el valor único de Moat."
    }
  ],
  "steps": [
    {
      "title": "Rapport Técnico",
      "desc": "Conectar con los retos del CIO/CTO.",
      "output": "Intro Check"
    },
    {
      "title": "Validación de Hipótesis",
      "desc": "Presentar el Anchor Statement y escuchar.",
      "output": "Hypothesis Pulse"
    },
    {
      "title": "Cuestionamiento de Implicación",
      "desc": "¿Qué pasa si no resuelven X hoy?",
      "output": "Pain Map"
    },
    {
      "title": "Exploración de Procesos",
      "desc": "Pedir que nos cuenten el paso a paso actual.",
      "output": "Process Flow"
    },
    {
      "title": "Detección de Bloqueadores",
      "desc": "Identificar quién se opone al cambio internamente.",
      "output": "Stakeholder Radar"
    },
    {
      "title": "Presentación de Casos",
      "desc": "Mostrar evidencia específica para su problema.",
      "output": "Evidence Pulse"
    },
    {
      "title": "Ejercicio de Co-creación",
      "desc": "Dibujar la solución ideal junto al cliente.",
      "output": "Draft Solution"
    },
    {
      "title": "Confirmación de Valor",
      "desc": "¿Ves cómo X resuelve tu GAP?",
      "output": "Value Sign-off"
    },
    {
      "title": "Acuerdo de MAP",
      "desc": "Listar los próximos pasos compartidos.",
      "output": "MAP Commitment"
    },
    {
      "title": "Cierre y Soft Ask",
      "desc": "Asegurar la siguiente reunión de arquitectura.",
      "output": "Next Meeting Lock"
    }
  ],
  "vitamin": "En el Discovery, hablar es de plata; escuchar es de oro. Quien hace las mejores preguntas, lidera la cuenta.",
  "standard": "Atomic Step 10/10 | Logic: Value-Driven Inquiry"
}