{
  "$schema": "../../../../templates/playbook-ritual-schema.json",
  "meta": {
    "id": "redactar-propuesta-tecnica-ritual",
    "segment": "empresas-b2b",
    "sop": "sop-structuring",
    "version": "V4.5 (HIGH-DENSITY)",
    "standard": "Moat Certified",
    "lastUpdated": "2026-02-16"
  },
  "playbook": {
    "title": "Redactar Propuesta Técnica",
    "subtitle": "The Authoring Ritual",
    "docType": "Playbook Operativo",
    "sopPhase": "Structuring",
    "breadcrumb": [
      "MetodologIA",
      "Proceso Comercial",
      "SOP Structuring",
      "Redactar Propuesta Técnica"
    ],
    "tldr": {
      "hook": "Define la pregunta crítica que este ritual resuelve.",
      "summary": "Resumen ejecutivo de 3 líneas sobre el propósito y resultado esperado.",
      "time": "~30 min",
      "mainOutput": "Proposal Final"
    },
    "objective": "Transformar el diseño técnico y las estimaciones en un documento persuasivo, claro y legalmente vinculante."
  },
  "glossary": [
    {
      "term": "SOW (Statement of Work)",
      "definition": "Documento que describe en detalle el alcance, los entregables y las fechas del proyecto."
    },
    {
      "term": "Executive Summary",
      "definition": "Resumen de alto nivel diseñado para que el decisor (CEO/CFO) entienda el valor sin leer todo el documento."
    },
    {
      "term": "Success Criteria",
      "definition": "Métricas acordadas que determinarán si el proyecto fue exitoso al finalizar."
    },
    {
      "term": "Moat Language",
      "definition": "Estilo de redacción que destaca la exclusividad y la ventaja competitiva de nuestra metodología."
    }
  ],
  "steps": [
    {
      "title": "Estructuración del SOW",
      "desc": "Definir capítulos y orden lógico.",
      "output": "Document Master"
    },
    {
      "title": "Redacción del Resumen Ejecutivo",
      "desc": "Enfocar en CBIs del Discovery.",
      "output": "Value Hook"
    },
    {
      "title": "Detalle de la Solución",
      "desc": "Integrar el C4 Model y explicación.",
      "output": "Solution Section"
    },
    {
      "title": "Cronograma de Hitos",
      "desc": "Basar en el Mutual Action Plan (MAP).",
      "output": "Milestone Map"
    },
    {
      "title": "Definición de Entregables",
      "desc": "Ser 100% específico en lo físico/digital.",
      "output": "Asset List"
    },
    {
      "title": "Inclusión de Estimaciones",
      "desc": "Mapear WBS al presupuesto formal.",
      "output": "Budget Table"
    },
    {
      "title": "Cláusulas de Soporte",
      "desc": "Definir el SLA del Día 2.",
      "output": "Service Spec"
    },
    {
      "title": "Asignación de DRI Moat",
      "desc": "Quién lidera el proyecto por nuestra parte.",
      "output": "Team Bio"
    },
    {
      "title": "Revisión Jurídica Básica",
      "desc": "Check de términos y responsabilidades.",
      "output": "Legal Alignment"
    },
    {
      "title": "Generación de PDF Soberano",
      "desc": "Exportar con branding premium v5.2.",
      "output": "Proposal Final"
    }
  ],
  "vitamin": "La propuesta no es solo una lista de tareas; es la promesa de un futuro mejor. Escribe para resolver, no solo para vender.",
  "standard": "Atomic Step 10/10 | Logic: Persuasive Engineering"
}