{
  "$schema": "../../templates/playbook-ritual-schema.json",
  "meta": {
    "id": "evaluar-fit-ritual",
    "segment": "aliados-gtm",
    "sop": "sop-alianzas",
    "version": "v3.1.0",
    "standard": "Sovereign Gold Master",
    "lastUpdated": "2026-02-19"
  },
  "playbook": {
    "title": "Evaluar Fit de Alianza",
    "subtitle": "The Integrity Filter",
    "docType": "Playbook Operativo",
    "sopPhase": "Partners",
    "breadcrumb": [
      "MetodologIA",
      "Proceso Comercial",
      "SOP Alianzas",
      "Evaluar Fit"
    ],
    "tldr": {
      "hook": "Proteger el ecosistema es la prioridad número uno.",
      "summary": "Este ritual audita la integridad moral, técnica y operativa de un aliado potencial para garantizar una relación de largo plazo.",
      "time": "~45 min",
      "mainOutput": "Fit Scorecard (Go / No-Go)"
    },
    "objective": "Validar la coherencia del aliado con el manifiesto soberano y su capacidad técnica real."
  },
  "glossary": [
    {
      "term": "Forensic Audit",
      "definition": "Análisis profundo de huella digital buscando señales de inconsistencia o falta de rigor."
    },
    {
      "term": "Sesión Socrática",
      "definition": "Técnica de entrevista basada en preguntas abiertas que revelan los valores y visión real del interlocutor."
    }
  ],
  "steps": [
    {
      "title": "Forensic Hard Audit",
      "desc": "IA escanea portafolio y testimonios buscando señales de 'Vaporware'.",
      "output": "REPORT: Audit de coherencia completado."
    },
    {
      "title": "Social Proof Check",
      "desc": "Buscamos menciones orgánicas y opiniones de terceros fuera del entorno controlado.",
      "output": "SHADOW: Verificación de reputación externa."
    },
    {
      "title": "The Vision Test",
      "desc": "Entrevista de 30 min para evaluar alineación filosófica a 5 años.",
      "output": "SCRIPT: Honestidad y Criterio validados."
    },
    {
      "title": "Decodificación de Dolor",
      "desc": "Identificamos dónde pierde dinero o tiempo hoy el aliado.",
      "output": "PAIN: Mapa de vulnerabilidad operativa."
    },
    {
      "title": "Prueba de Concepto",
      "desc": "Reto técnico rápido usando una herramienta del stack MetodologIA.",
      "output": "POC: Capacidad técnica probada."
    },
    {
      "title": "Trust Scorecard",
      "desc": "Aplicación de matriz de 5 dimensiones (Ética, IQ, Reach, Tooling, Vibe).",
      "output": "SCORE: Puntaje sobre 100 calculado."
    },
    {
      "title": "Risk Analysis",
      "desc": "Identificamos riesgos de marca o técnicos de integrar a este partner.",
      "output": "RISK: Matriz de mitigación básica."
    },
    {
      "title": "DRI Alignment",
      "desc": "Definimos al Direct Responsible Individual dentro del equipo del aliado.",
      "output": "DRI: Responsable identificado."
    },
    {
      "title": "Veredicto Moat",
      "desc": "Decisión final basada en el umbral de 70 puntos.",
      "output": "GO/NO-GO: Resultado final."
    },
    {
      "title": "Ritual Handoff",
      "desc": "Documentamos los anclajes de valor para la propuesta comercial.",
      "output": "INFO: Reporte de Fit enviado."
    }
  ],
  "vitamin": "Mejor un aliados menos que un aliado mediocre. La excelencia no es negociable.",
  "standard": "MetodologIA Sovereign Gold | v3.1"
}
